Laptop Name,Price,Ratings
"Dell Inspiron 15 3000 3520 Business Laptop Computer[Windows 11 Pro], 15.6'' FHD Touchscreen, 11th Gen Intel Quad-Core i5-1135G7, 16GB RAM, 1TB PCIe SSD, Numeric Keypad, Wi-Fi, Webcam, HDMI, Black",$476.48,4.2
"Dell Inspiron 3511 Laptop, 15.6"" Full HD Touchscreen, Intel Core i5-1135G7 (Beats Intel i7-1065G7), 32GB DDR4 RAM, 1TB PCIe SSD, SD Card Reader, HDMI, Wi-Fi, Windows 11 Home, Black",$483.92,4.0
"Dell Inspiron Laptop, 15.6"" FHD Touchscreen, Intel Quad-Core i5-1155G7, Webcam, HDMI, Wi-Fi, USB, Windows 11 Pro, Microsoft Office 1Year, Black (64GB RAM | 1TB SSD)",$679.00,4.4
"Dell Inspiron 15 3511 15.6 Inch Laptop, Full HD LED Non-Touch WVA Display - Intel Core i3-1115G4, 8GB DDR4 RAM, 256GB SSD, UHD Graphics, Windows 11 Home - Carbon Black",$320.81,4.1
"Dell Newest Inspiron 15 3511 Laptop, 15.6"" FHD Touchscreen, Intel Core i5-1035G1, 12GB RAM, 256GB PCIe NVMe M.2 SSD, SD Card Reader, Webcam, HDMI, WiFi, Windows 11 Home, Black",$414.95,4.3
Dell Latitude 5510 Business Laptop 15.6-inch FHD (1920 x 1080) LCD Intel Core i7-10610U Processor 32GB RAM 512GB SSD Windows 10 Pro (Renewed),$399.99,4.0
"Dell Latitude 7490 14 HD Anti-Glare, Intel Core i5-8350U, 16GB DDR4, 256GB Solid State Drive, Webcam, Bluetooth, Windows 10Pro (Renewed)",$199.90,4.1
"Dell Newest Inspiron 15.6'' Everyday Laptop, Intel Dual-Core Processor, HD Anti-Glare Display, SD-Card Reader, Wi-Fi & Bluetooth, HDMI, Webcam, WOWPC Bundle (Windows 11 Home, 32GB RAM | 1TBSSD)",$449.99,4.0
"Dell Inspiron Touchscreen Laptop (15.6"" FHD Touch, Intel Core i5-1155G7, 16GB RAM, 512GB SSD) for Business, Students, Enterprises, Numeric Keypad, Narrow-Bezel, Webcam, Win 11 Pro, Carbon Black",$528.98,4.8
"Dell Inspiron 16 Plus 7640 Laptop - 16.0-inch 16:10 2.5K Display, Intel Core i7-13620H Processor, 16GB LPDDR5 RAM, 1TB SSD, Intel UHD Graphics, Windows 11 Home, Onsite & Migrate Service - Ice Blue",$902.99,4.0
"Dell Inspiron Touchscreen Laptop, 15.6"" Business & Student Laptop Computer, Windows 11 Pro Laptop 32GB RAM 1TB SSD, Intel i5-1155G7 Processor, Full HD IPS Display, Numeric Keypad, HDMI, Carbon Black",$649.99,4.3
"Dell Inspiron 3530 Laptop - 15.6-inch FHD 120Hz Display, Intel Core i5-1334U Processor, 16GB DDR4 RAM, 512GB SSD, Intel Iris Xe Graphics, Windows 11 Home, Migrate Services - Platinum Silver (Aluminum)",$591.52,4.0
"Dell Newest 13th Generation Business Inspiron 15 3530 Laptop, 15.6"" FHD Touchscreen, Intel Core i7-1355U, 32GB RAM, 1TB SSD, Webcam, HDMI, Wi-Fi 6, Windows 11 Pro, Black",$522.49,3.8
"Dell Inspiron 15 3520 3000 15.6"" Touchscreen FHD Business Laptop Computer, 12th Gen Intel 10-Core i5-1235U (Beat i7-1195G7), 32GB DDR4 RAM, 1TB PCIe SSD, 802.11AC WiFi, Bluetooth, Windows 11 Pro S",$589.00,5.0
"Dell 2023 Newest Inspiron 15 3520 Laptop, 15.6"" FHD Display, Intel Core i5-1135G7 up to 4.2GHz, 8GB RAM, 256GB SSD, Intel UHD Graphics, Wi-Fi, Bluetooth, Windows 11 Home",$379.00,4.1
"Dell Latitude 5550 15 Business AI Laptop, 15.6"" FHD Computer, Intel Ultra 7 155U (Beat i7-1355U), 32GB DDR5 RAM, 1TB PCIe SSD, WiFi 6, Backlit Keyboard, Fingerprint Reader, Windows 11 Pro","$1,249.00",3.5
"Dell Latitude 7390 Ultrabook | Intel Core i7 8th Gen Quad Core CPU | 16 GB RAM - 1 TB SSD | 13.3"" Touchscreen FHD Display with Webcam | Wi-Fi | Bluetooth | Microsoft Office | Windows 11 (Renewed)",$326.55,4.0
"Dell 2023 Newest Inspiron 15 3525 Laptop, 15.6"" FHD Display, AMD Ryzen 5 5500U Processor up to 4GHz, 16GB RAM, 512GB SSD, AMD Radeon Graphics, Wi-Fi, Bluetooth, Windows 11 Home",$448.00,4.2
"Dell 2023 Newest Inspiron Laptop, 15.6"" FHD IPS Touchscreen, Intel Core i5-1155G7(Beats i7-1065G7) Processor (Quad-core), 16GB RAM, 512GB SSD, Wi-Fi, Bluetooth, Windows 11 Home, Carbon Black",$443.91,4.1
"Dell Latitude 5420 14"" Notebook, Intel Core i5-1145G7, 16GB RAM, 512GB SSD, Intel Iris Xe Graphics, Windows 10 Pro (Renewed)",$290.22,4.0
"Dell Inspiron Touchscreen Laptop, 15.6"" Business & Student Laptop Computer, Windows 11 Pro Laptop 64GB RAM 1TB SSD, Intel Core i7-1255U Processor, FHD Display, Microsoft Office Lifetime License, Black",$939.99,4.0
"Dell Newest 13th Generation Inspiron 15 3530 Laptop, 15.6"" FHD Touchscreen, Intel Core i7-1355U, 32GB RAM, 1TB SSD, Webcam, HDMI, Wi-Fi 6, Windows 11 Home, Black",$749.99,4.3
"Dell Inspiron 15 3000 Series 3511 Laptop, 15.6"" FHD Touchscreen, Intel Core i5-1035G1, 32GB DDR4 RAM, 1TB PCIe SSD, SD Card Reader, Webcam, HDMI, Wi-Fi, Windows 11 Home, Black",$499.05,4.1
"Dell Newest 13th Generation Business Inspiron 15 3530 Laptop, 15.6"" FHD Touchscreen, Intel Core i7-1355U, 64GB RAM, 2TB SSD, Webcam, HDMI, Wi-Fi 6, Windows 11 Pro, Black",$889.90,4.0
"Dell Inspiron 5440 Laptop - 14.0-inch 16:10 FHD+ (1920 x 1200) Display, Intel Core 7-150U Processor, 16GB DDR5 RAM, 1TB SSD, Intel Graphics, Windows 11 Home, Onsite Service - Carbon Black",$749.99,4.0
"Dell Inspiron 15 3520 3000 15.6"" Touchscreen FHD Laptop Computer, 12th Gen Intel 10-Core i5-1235U (Beat i7-1195G7), 32GB DDR4 RAM, 1TB PCIe SSD, 802.11AC WiFi, Bluetooth, Windows 11 Home S",$599.00,5.0
"Dell Latitude 7490 Intel Core i7-8650U 16GB DDR4 RAM, 512GB SSD 14"" FHD Windows 10 Pro Laptop (Renewed)",$287.99,4.1
"Dell Inspiron 15 3000 3520 15.6"" FHD Touchscreen (Intel 4-Core i5-1135G7, 16GB RAM, 512GB PCIe SSD, UHD Graphics) Business Laptop, WVA Anti-Glare, Numeric Keypad, Webcam, Wi-Fi, Win 11 Pro, Black",$464.00,4.2
"Dell 15 15.6"" FHD 120Hz Business Laptop Computer, Intel 10-Core i5-1235U (Beat i7-1195G7), 32GB DDR4 RAM, 1TB PCIe SSD, 802.11ac WiFi, Bluetooth, RJ-45, HDMI, Carbon Black, Windows 11 Pro",$659.00,4.4
"Dell G5 Laptop 2024 New, 15.6"" FHD IPS ~ Intel i7-13650HX 14-Core ~ NVIDIA GeForce RTX 4060~64GB DDR5~1TB SSD ~ Backlit Keyboard ~ Wi-Fi 6 ~ Win11 Pro WWC 32GB USB","$1,599.00",N/A
"DELL Latitude 7420 Business Laptop, Touchscreen Notebook, 14"" FHD(1920x1080), Intel Core i7-1185G7, 32GB RAM, 512GB SSD, Backlit Keyboard, WiFi, Bluetooth, Windows 11 Pro-Carbon Fiber(Renewed)",$488.00,4.1
"Dell 5420 Latitude Laptop 14"" FHD (1920x1080) Notebook, Intel 11th Gen Core i7-1185G7, 16GB RAM, 512GB SSD, Thunderbolt, HDMI, Type-C, CAM, WiFi Windows 10 Pro (Renewed)",$349.99,4.2
"Dell Latitude 7480 Laptop - Intel Core i5-7300U CPU 2.60GHz, 16GB RAM, 256GB SSD, 14 HD Display, Webcam, Windows 10 Pro (Renewed)",$164.67,4.2
"Dell Inspiron 3520 15.6"" FHD Laptop, Intel Core i7-1255U Processor, 32GB RAM, 1TB SSD, Webcam, HDMI, SD-Card Slot, Wi-Fi 6, Windows 11 Home, Black",$630.99,3.6
"Dell XPS 15 9530 Business Laptop (15.6"" FHD+, Intel 10-Core i7-13620H (Beat i9-12900H), 32GB DDR5 RAM, 1TB SSD), Backlit, Fingerprint, Thunderbolt 4, Wi-Fi 6, IST HUB, Win 11 Pro w/AI Copilot, Silver","$1,562.75",4.5
"Dell Inspiron 15 3535 15.6"" Touch Screen FHD Business Laptop, AMD Ryzen 5 7530U Processor (Beats i7-1165G7) 16GB RAM 512GB PCIe SSD USB-C,WI-FI, Bluetooth, HDMI, Win11 Carbon Black",$439.00,4.7
"Dell Inspiron 15 3520 15.6"" FHD Laptop, Intel Core i7-1255U Processor, 32GB RAM,1TB SSD, SD Card Reader, WiFi, Bluetooth, Webcam, Win 11 Home, Alpacatec Accessories, Carbon Black",$739.00,5.0
"Dell 2024 Newest Inspiron 15 3530 Business Laptop, 15.6"" FHD Touchscreen, Intel 10-Core i7-1355U CPU, 64GB RAM, 2TB SSD, WiFi 6, Webcam, HDMI, with Microsoft Office Lifetime License & Windows 11 Pro","$1,059.99",4.3
"Dell Inspiron 15.6 Inch FHD Business Laptop, Intel Core i7-1255U, 32GB RAM, 1TB SSD, Windows 11 Pro, Backlit Keyboard, Webcam, WiFi, Carbon Black",$699.00,3.5
"Dell Inspiron 15 3520 (2024) Business Laptop (15.6"" FHD Touchscreen IPS, Intel Core i5-1155G7, 32GB RAM, 1TB SSD) Numeric Keypad, Narrow-Bezel, Webcam, Inspiron 3000, Win 11 Home S Mode, Carbon Black",$539.00,3.8
"Dell Latitude 5420 Business Laptop (14"" FHD Display, Intel Core i5-1135G7, 16GB RAM, 512GB SSD) Backlit, Webcam, Ethernet Port, Wi-Fi, Thunderbolt 4, Long Battery Life, Latitude 5000, Win 11 Pro, Gray",$699.98,4.4
"Dell 2022 Newest Latitude 3520 15.6"" FHD Business Laptop, Intel Core i7-1165G7, 64GB DDR4 RAM, 1TB PCIe SSD, Webcam, HDMI, Wi-Fi 6, Windows 11 Pro, Black","$1,173.81",5.0
"Dell Inspiron Business Laptop, 15.6"" FHD Touchscreen, Intel 10-Core i7-1355U, 16GB RAM, 1TB SSD, Intel Iris Xe GPU, Webcam, Wi-Fi 6, Windows 11 Pro, with Microsoft Office Lifetime License&Laptop Stand",$859.00,4.6
"Dell Newest 13th Generation Business Inspiron 15 3530 Laptop, 15.6"" FHD Touchscreen, Intel Core i7-1355U, 64GB RAM, 1TB SSD, Webcam, HDMI, Wi-Fi 6, Windows 11 Pro, Black",$844.99,4.8
"Dell Inspiron 5000 15.6 Inch FHD 1080P Touchscreen Laptop (Intel Core i7-1065G7 up to 3.9GHz, 16GB DDR4 RAM, 512GB SSD, Intel UHD Graphics, Backlit KB, HDMI, WiFi, Bluetooth, Win10)",$879.99,4.3
Dell Latitude 5400 Laptop 14 Intel Core i5 8th Gen i5-8365U Dual Core 256GB SSD 16GB 1920x1080 FHD Windows 10 Pro (Renewed),$161.36,4.2
"Dell Inspiron Business Laptop, 15.6 Inch FHD Touchscreen, 11th Gen Intel Core i5, Windows 11 Pro, 16GB RAM, 1TB HDD, Lifetime Office, Numeric Keypad, Full-Size Keyboard, HDMI, Long Battery Life, Black",$599.00,4.3
"DELL Latitude 5490 14"" FHD Business Laptop, Intel i5-8350U Quad Processor, 16GB RAM, 512GB PCIe SSD, Intel UHD Graphics, Backlit Keyboard, HD Webcam, Windows 11 Pro, Black",$205.99,3.0
